{
  "$schema": "https://schemas.cratis.io/factory/v1/project-manifest.schema.json",
  "schemaVersion": "1",
  "documentKind": "project-manifest",
  "repositoryMode": "framework",
  "profiles": {
    "include": [],
    "exclude": []
  },
  "workflows": {
    "investigate-cratis-issue": "1.0.0"
  },
  "policy": {
    "id": "local-development",
    "denyCapabilities": []
  }
}
